{
  "schema_version": 0,
  "plan_id": "plan.week1-food",
  "base_revision": "a1b2c3d4e5f6",
  "horizon_ticks": 60000,
  "actions": [
    {
      "template_id": "prioritize-work",
      "params": {
        "pawn": "pawn-1",
        "priorities": {"Growing": 1, "Cooking": 2}
      }
    },
    {
      "template_id": "haul-designate",
      "params": {"designator": "haul", "cells": [[12, 40], [13, 40]]}
    }
  ],
  "policy_mutations": [
    {
      "op": "edit_decision_map",
      "target": "q.action",
      "patch": {
        "question": "q.action",
        "choice": "gather",
        "action": {
          "template_id": "haul-designate",
          "params": {"designator": "haul", "cells": ["{state.haul_cell}"]}
        }
      }
    }
  ],
  "rationale": "Secure food supply before end of day 3."
}
